{
  "schemaVersion": "math-assets-v1",
  "catalogVersion": "1.0.0",
  "description": "Canonical unified math assets definition catalog for Astra.",
  "assets": [
    {
      "assetId": "math.equations",
      "name": "定义域与方程",
      "version": "1.0.0",
      "summary": "分析定义域约束、等价代数变换、实根多项式判别与代数方程系统解集。",
      "instructions": {
        "conditions": [
          "原式及变量域可明确保留，求解目标是原式而非约分/平方后的替代式",
          "对可能为零、异号、参数退化的代数变形必须拆分支讨论",
          "函数方程必须明确全称量词与自变量取值范围"
        ],
        "procedure": [
          "变形前先登记分母非零、根号被开方式非负、对数真数大于零等定义域限制",
          "对推导变形严格区分'充要等价'与'必要推导'；必要推导后必须代回原式排除增根",
          "求完整解集时必须独立证明解集的完备性（无漏解）",
          "调用实根判别或多项式化简核对中间代数步骤的严格零差"
        ],
        "misuse": [
          "把 sqrt(x^2) 无条件写成 x，忽略绝对值与分支",
          "把多项式等价化简等同于求解完原方程，忽略约去因式导致的定义域改变",
          "把隔离实解个数的数值探测当作完整代数证明"
        ],
        "verificationBoundary": "符号计算与化简仅保证给定输入在代数上的严格零差与孤立根计数，不自动证明原题建模与定义域还原的完整性。"
      },
      "behaviors": [
        {
          "target": "real_roots",
          "implementationRef": "impl.equations.real-roots.v1",
          "legacyToolName": "real_root_count_expr",
          "legacyOperation": null,
          "declaredScope": "Exact real root count of a univariate rational polynomial via Sturm sequence",
          "requiredParams": [
            "expression"
          ],
          "optionalParams": [
            "variable",
            "timeout_ms"
          ],
          "resultType": "integer",
          "evidenceCeiling": "EXACT_FOR_INPUT",
          "consumer": "compare.real-roots.v1"
        },
        {
          "target": "simplify",
          "implementationRef": "impl.equations.simplify.v1",
          "legacyToolName": "exact_check_expr",
          "legacyOperation": "SIMPLIFY",
          "declaredScope": "Exact algebraic canonicalization and zero-residual verification of rational expressions",
          "requiredParams": [
            "expression"
          ],
          "optionalParams": [
            "variable"
          ],
          "resultType": "polynomial",
          "evidenceCeiling": "EXACT_FOR_INPUT",
          "consumer": "compare.polynomial.v1"
        },
        {
          "target": "solve_system",
          "implementationRef": "impl.equations.solve-system.v1",
          "legacyToolName": "solve_system_guarded_expr",
          "legacyOperation": null,
          "declaredScope": "Isolated real solutions count for guarded affine or decoupled polynomial systems",
          "requiredParams": [
            "expressions",
            "variables"
          ],
          "optionalParams": [
            "timeout_ms",
            "n_starts",
            "seed"
          ],
          "resultType": "integer",
          "evidenceCeiling": "NUMERICAL_FOR_INPUT",
          "consumer": "record.bounded-observation.v1"
        },
        {
          "target": "function_identity",
          "implementationRef": "impl.equations.function-identity.v1",
          "legacyToolName": "polynomial_function_check",
          "legacyOperation": null,
          "declaredScope": "Exact identity check and counterexample search for polynomial candidates in functional equations",
          "requiredParams": [
            "equation",
            "function",
            "argument",
            "variables",
            "expression"
          ],
          "optionalParams": [],
          "resultType": "boolean",
          "evidenceCeiling": "EXACT_FOR_INPUT",
          "consumer": "compare.polynomial-identity.v1"
        }
      ],
      "examples": {
        "positive": [
          {
            "description": "求三次方程 x^3 - 3x + 1 = 0 的不同实根个数",
            "input": {
              "target": "real_roots",
              "expression": "x**3 - 3*x + 1",
              "variable": "x"
            }
          },
          {
            "description": "验证代数式化简零差",
            "input": {
              "target": "simplify",
              "expression": "(x**2 - 1)/(x - 1)",
              "variable": "x"
            }
          }
        ],
        "negative": [
          {
            "description": "含超越函数方程的全局解析解求解",
            "reason": "超越方程全局解集超出代数方程算子边界，应转入分析推理。"
          }
        ]
      },
      "inputSchema": {
        "type": "object",
        "required": [
          "target"
        ],
        "properties": {
          "target": {
            "type": "string",
            "enum": [
              "analyze",
              "real_roots",
              "simplify",
              "solve_system",
              "function_identity"
            ],
            "description": "Mathematical target of the request"
          },
          "question": {
            "type": "string",
            "description": "For analyze target: the mathematical question or theorem to inspect"
          },
          "assumptions": {
            "type": "array",
            "items": {
              "type": "string"
            },
            "description": "For analyze target: list of explicit mathematical assumptions"
          },
          "expression": {
            "description": "Parameter expression for target real_roots"
          },
          "variable": {
            "description": "Parameter variable for target real_roots"
          },
          "timeout_ms": {
            "description": "Parameter timeout_ms for target real_roots"
          },
          "expressions": {
            "description": "Parameter expressions for target solve_system"
          },
          "variables": {
            "description": "Parameter variables for target solve_system"
          },
          "n_starts": {
            "description": "Parameter n_starts for target solve_system"
          },
          "seed": {
            "description": "Parameter seed for target solve_system"
          },
          "equation": {
            "description": "Parameter equation for target function_identity"
          },
          "function": {
            "description": "Parameter function for target function_identity"
          },
          "argument": {
            "description": "Parameter argument for target function_identity"
          }
        }
      }
    },
    {
      "assetId": "math.proof",
      "name": "证明与反例",
      "version": "1.0.0",
      "summary": "命题逻辑结构化分析、量词转换、证明义务分解与有限反例/见证搜索。",
      "instructions": {
        "conditions": [
          "命题包含明确全称量词 ∀ 或存在量词 ∃",
          "否定全称命题只需构造一个满足前提且否定结论的具体见证反例",
          "证明全称命题必须给出一般性演绎，有限个例不能当作证明"
        ],
        "procedure": [
          "识别待证命题的前提集合 P 与结论集合 Q",
          "对否定全称命题 ∀x P(x) => Q(x)，转换为存在性寻找 ∃x (P(x) ∧ ¬Q(x))",
          "在极小退化边界或小规模有限参数空间中暴力搜索潜在反例",
          "若找到具体反例，给出显式参数并验证其严格满足反例条件"
        ],
        "misuse": [
          "在有限个小参数上验证成立后，声称已证明全称命题",
          "构造的反例并不满足题设前提 P"
        ],
        "verificationBoundary": "反例见证只对显式构造的具体对象有效；未找到反例不能作为命题成立的数学证明。"
      },
      "behaviors": [],
      "examples": {
        "positive": [
          {
            "description": "命题分析与反例寻找指导",
            "input": {
              "target": "analyze",
              "question": "是否存在不满足可交换性的4阶有限群？"
            }
          }
        ],
        "negative": [
          {
            "description": "请求输出任意哥德巴赫猜想的机器证明",
            "reason": "超出有界推理能力，应分解为具体有限引理。"
          }
        ]
      },
      "inputSchema": {
        "type": "object",
        "required": [
          "target"
        ],
        "properties": {
          "target": {
            "type": "string",
            "enum": [
              "analyze"
            ],
            "description": "Mathematical target of the request"
          },
          "question": {
            "type": "string",
            "description": "For analyze target: the mathematical question or theorem to inspect"
          },
          "assumptions": {
            "type": "array",
            "items": {
              "type": "string"
            },
            "description": "For analyze target: list of explicit mathematical assumptions"
          }
        }
      }
    },
    {
      "assetId": "math.invariants",
      "name": "不变量与极值构造",
      "version": "1.0.0",
      "summary": "离散变换下的守恒不变量、单调势能函数、双计数界与极值构型构造。",
      "instructions": {
        "conditions": [
          "系统经历离散状态转移或局域操作",
          "存在模同余、奇偶性、拓扑指标或多项式守恒量",
          "包含二元关系发生图的双计数（Double Counting）"
        ],
        "procedure": [
          "写出基本操作引起的状态变化量 ΔS",
          "寻找在所有允许操作下保持严格不变的映射 I(S_next) = I(S_curr)",
          "对比初始状态 I(S_0) 与目标状态 I(S_target)，若二者在不变量下不相等，则目标不可达",
          "若构建不等式界，通过二元关系发生矩阵的行和与列和建立双计数等式"
        ],
        "misuse": [
          "假设的单调势能存在反弹循环却声称必定终止",
          "把局部极值误当成全局唯一极值构型"
        ],
        "verificationBoundary": "不变量检查只验证给定变换在代数上是否严格零差；不变量相符不代表目标态必定可达。"
      },
      "behaviors": [
        {
          "target": "polynomial_invariant",
          "implementationRef": "impl.invariants.poly-invariant.v1",
          "legacyToolName": "polynomial_invariant_check",
          "legacyOperation": null,
          "declaredScope": "Exact check of polynomial invariance under forward discrete polynomial mappings",
          "requiredParams": [
            "base_variables",
            "variables",
            "forward",
            "target",
            "invariants"
          ],
          "optionalParams": [],
          "resultType": "boolean",
          "evidenceCeiling": "EXACT_FOR_INPUT",
          "consumer": "compare.polynomial-identity.v1"
        },
        {
          "target": "double_counting",
          "implementationRef": "impl.invariants.double-counting.v1",
          "legacyToolName": "double_counting_bound",
          "legacyOperation": null,
          "declaredScope": "Exact comparison and bounding between two incidence count views",
          "requiredParams": [
            "count_a",
            "count_b"
          ],
          "optionalParams": [
            "description"
          ],
          "resultType": "boolean",
          "evidenceCeiling": "EXACT_FOR_INPUT",
          "consumer": "record.bounded-observation.v1"